{
  "schemaVersion": "f0.fixture.v1",
  "fixtureId": "gbif-occurrence-parco-nord-2026-09-14",
  "provider": "GBIF",
  "dataset": "GBIF occurrence search — iNaturalist research-grade observations",
  "retrievedAt": "2026-09-14T12:36:46Z",
  "query": {
    "id": "gbif-occurrence-parco-nord-v1",
    "method": "GET",
    "url": "https://api.gbif.org/v1/occurrence/search?geometry=POLYGON%28%289.171%2045.511%2C9.210%2045.511%2C9.210%2045.540%2C9.171%2045.540%2C9.171%2045.511%29%29&taxon_key=1&occurrence_status=present&has_coordinate=true&has_geospatial_issue=false&limit=5",
    "spatialMode": "polygon",
    "limit": 5,
    "httpStatus": 200
  },
  "response": {
    "count": 13522,
    "offset": 0,
    "limit": 5,
    "results": [
      {
        "key": 5938033634,
        "acceptedTaxonKey": 5163063,
        "acceptedScientificName": "Takahashia japonica (Cockerell, 1896)",
        "kingdom": "Animalia",
        "taxonRank": "SPECIES",
        "eventDate": "2026-01-02T13:47",
        "decimalLatitude": 45.530011,
        "decimalLongitude": 9.20274,
        "coordinateUncertaintyInMeters": 800,
        "basisOfRecord": "HUMAN_OBSERVATION",
        "occurrenceStatus": "PRESENT",
        "issues": ["COORDINATE_ROUNDED", "CONTINENT_DERIVED_FROM_COORDINATES", "TAXON_ID_NOT_FOUND"],
        "references": "https://www.inaturalist.org/observations/333159766",
        "license": "http://creativecommons.org/licenses/by-nc/4.0/legalcode",
        "datasetName": "iNaturalist research-grade observations"
      },
      {
        "key": 5938043804,
        "acceptedTaxonKey": 2495455,
        "acceptedScientificName": "Columba palumbus Linnaeus, 1758",
        "kingdom": "Animalia",
        "taxonRank": "SPECIES",
        "eventDate": "2026-01-02T13:53",
        "decimalLatitude": 45.530011,
        "decimalLongitude": 9.20274,
        "coordinateUncertaintyInMeters": 800,
        "basisOfRecord": "HUMAN_OBSERVATION",
        "occurrenceStatus": "PRESENT",
        "issues": ["COORDINATE_ROUNDED", "CONTINENT_DERIVED_FROM_COORDINATES", "TAXON_ID_NOT_FOUND"],
        "references": "https://www.inaturalist.org/observations/333146297",
        "license": "http://creativecommons.org/licenses/by-nc/4.0/legalcode",
        "datasetName": "iNaturalist research-grade observations"
      },
      {
        "key": 5938047530,
        "acceptedTaxonKey": 2494422,
        "acceptedScientificName": "Fringilla coelebs Linnaeus, 1758",
        "kingdom": "Animalia",
        "taxonRank": "SPECIES",
        "eventDate": "2026-01-03T15:49",
        "decimalLatitude": 45.530011,
        "decimalLongitude": 9.20274,
        "coordinateUncertaintyInMeters": 800,
        "basisOfRecord": "HUMAN_OBSERVATION",
        "occurrenceStatus": "PRESENT",
        "issues": ["COORDINATE_ROUNDED", "CONTINENT_DERIVED_FROM_COORDINATES", "TAXON_ID_NOT_FOUND"],
        "references": "https://www.inaturalist.org/observations/333303432",
        "license": "http://creativecommons.org/licenses/by-nc/4.0/legalcode",
        "datasetName": "iNaturalist research-grade observations"
      },
      {
        "key": 5938052496,
        "acceptedTaxonKey": 4485843,
        "acceptedScientificName": "Halyomorpha halys (Stål, 1855)",
        "kingdom": "Animalia",
        "taxonRank": "SPECIES",
        "eventDate": "2026-01-02T14:48",
        "decimalLatitude": 45.530011,
        "decimalLongitude": 9.20274,
        "coordinateUncertaintyInMeters": 800,
        "basisOfRecord": "HUMAN_OBSERVATION",
        "occurrenceStatus": "PRESENT",
        "issues": ["COORDINATE_ROUNDED", "CONTINENT_DERIVED_FROM_COORDINATES", "TAXON_ID_NOT_FOUND"],
        "references": "https://www.inaturalist.org/observations/333159771",
        "license": "http://creativecommons.org/licenses/by-nc/4.0/legalcode",
        "datasetName": "iNaturalist research-grade observations"
      },
      {
        "key": 5938061413,
        "acceptedTaxonKey": 5219681,
        "acceptedScientificName": "Sciurus carolinensis Gmelin, 1788",
        "kingdom": "Animalia",
        "taxonRank": "SPECIES",
        "eventDate": "2026-01-02T14:11",
        "decimalLatitude": 45.530011,
        "decimalLongitude": 9.20274,
        "coordinateUncertaintyInMeters": 800,
        "basisOfRecord": "HUMAN_OBSERVATION",
        "occurrenceStatus": "PRESENT",
        "issues": ["COORDINATE_ROUNDED", "CONTINENT_DERIVED_FROM_COORDINATES", "TAXON_ID_NOT_FOUND"],
        "references": "https://www.inaturalist.org/observations/333159768",
        "license": "http://creativecommons.org/licenses/by-nc/4.0/legalcode",
        "datasetName": "iNaturalist research-grade observations"
      }
    ]
  }
}
